{"current":"sha256:a18d69c10f55ee7f17853f9b8cf793f749efe120879f7b7b01f015187a2b14d9","last_verified":"sha256:a18d69c10f55ee7f17853f9b8cf793f749efe120879f7b7b01f015187a2b14d9","schema_version":8,"snapshots":{"sha256:a18d69c10f55ee7f17853f9b8cf793f749efe120879f7b7b01f015187a2b14d9":{"agent_runs":[{"adapter":"omp","adapter_version":"18.2.11","argv_template":["-p","--cwd","<workspace>","--no-session","--no-rules","--no-skills","--no-extensions","--no-lsp","--no-pty","--no-title","--tools","read,grep,glob,edit,write","--approval-mode","yolo","--max-time","<seconds>s","--config","<overlay>","@<prompt-file>"],"duration_ms":46410,"environment_names":["HOME","PATH","PI_CODING_AGENT_DIR","PYTHONDONTWRITEBYTECODE","TMPDIR"],"executable":"/home/arthur/.bun/install/global/node_modules/@oh-my-pi/pi-coding-agent/dist/cli.js","executable_hash":"sha256:ce797fb3ed92e768c8c8f0f852bcc3150d8ed4b4e9a8eaab897694ae54b0d3de","implementation_hash":"sha256:46b7e60d4738490b0f8bd84d385fbacb25949b4e7565ff630e282fe3586cbf3f","prompt_hash":"sha256:7332183e7e7836dc541694195cf974e563f15c1c06b3a417aced6e34e54c65f1","status":{"cancelled":false,"exit_code":0,"signal":null,"timed_out":false},"stderr":{"bytes":11,"sha256":"sha256:dfef4c342f986ab93a9e0bb90f2d88c3bf25b2455853253d31ef95c1c55192a7","truncated":false},"stdout":{"bytes":564,"sha256":"sha256:cce706986bd191d3bdc8aeb75170382eb137dd3cce93badbcc1a49409502fb7e","truncated":false},"symbol":"curriculum.artifact_pipeline.plan_pipeline"},{"adapter":"omp","adapter_version":"18.2.11","argv_template":["-p","--cwd","<workspace>","--no-session","--no-rules","--no-skills","--no-extensions","--no-lsp","--no-pty","--no-title","--tools","read,grep,glob,edit,write","--approval-mode","yolo","--max-time","<seconds>s","--config","<overlay>","@<prompt-file>"],"duration_ms":142889,"environment_names":["HOME","PATH","PI_CODING_AGENT_DIR","PYTHONDONTWRITEBYTECODE","TMPDIR"],"executable":"/home/arthur/.bun/install/global/node_modules/@oh-my-pi/pi-coding-agent/dist/cli.js","executable_hash":"sha256:ce797fb3ed92e768c8c8f0f852bcc3150d8ed4b4e9a8eaab897694ae54b0d3de","implementation_hash":"sha256:9a0085d4618094b0a3705ea6639019fe372c7ddf420df912383ae6dbc5259a52","prompt_hash":"sha256:906f377f81f452dfa94f766c1aa1511ccac3a886b0af72f9b6462b0a69b06972","status":{"cancelled":false,"exit_code":0,"signal":null,"timed_out":false},"stderr":{"bytes":11,"sha256":"sha256:dfef4c342f986ab93a9e0bb90f2d88c3bf25b2455853253d31ef95c1c55192a7","truncated":false},"stdout":{"bytes":1681,"sha256":"sha256:2b2c01183ad56ea28fcc47d7ad66e107930bfbe0384642d26aa4a91a95192d21","truncated":false},"symbol":"curriculum.artifact_pipeline.topologically_order_steps"}],"compatibility":{"canonical_ir_schema":9,"contract_strategy_schema":6,"generation_schema":8,"runtime_abi":7},"contract_surface":{"curriculum.artifact_pipeline":{"declarations":[{"annotations":[],"doc":null,"fields":[{"default":null,"name":"name","type":{"kind":"primitive","name":"str"}},{"default":null,"name":"needs","type":{"item":{"kind":"primitive","name":"str"},"kind":"set"}}],"generics":[],"invariants":[],"kind":"struct","name":"curriculum.artifact_pipeline.BuildStep","public":true},{"annotations":[],"doc":null,"fields":[{"default":null,"name":"steps","type":{"item":{"args":[],"kind":"named","name":"curriculum.artifact_pipeline.BuildStep"},"kind":"list"}}],"generics":[],"invariants":[],"kind":"struct","name":"curriculum.artifact_pipeline.Pipeline","public":true},{"annotations":[],"doc":null,"fields":[{"default":null,"name":"ordered_steps","type":{"item":{"kind":"primitive","name":"str"},"kind":"list"}}],"generics":[],"invariants":[],"kind":"struct","name":"curriculum.artifact_pipeline.ArtifactPlan","public":true},{"annotations":[],"doc":null,"generics":[],"kind":"enum","name":"curriculum.artifact_pipeline.ArtifactPipelineError","public":true,"variants":[{"fields":[],"name":"BlankStepName","symbol":"curriculum.artifact_pipeline.ArtifactPipelineError.BlankStepName"},{"fields":[],"name":"DuplicateStep","symbol":"curriculum.artifact_pipeline.ArtifactPipelineError.DuplicateStep"},{"fields":[],"name":"UnknownDependency","symbol":"curriculum.artifact_pipeline.ArtifactPipelineError.UnknownDependency"},{"fields":[],"name":"SelfDependency","symbol":"curriculum.artifact_pipeline.ArtifactPipelineError.SelfDependency"},{"fields":[],"name":"Cycle","symbol":"curriculum.artifact_pipeline.ArtifactPipelineError.Cycle"}]},{"annotations":[{"argument":null,"name":"cott.complete_errors"}],"body":null,"callable_kind":"sync","contract":{"clauses":[{"clause_id":1,"expression":{"arguments":[{"kind":"binding_ref","reference":{"kind":"binding","symbol":"curriculum.artifact_pipeline.ordered_steps"},"symbol":"curriculum.artifact_pipeline.ordered_steps","type":{"item":{"kind":"primitive","name":"str"},"kind":"list"}},{"kind":"parameter_ref","reference":{"kind":"parameter","symbol":"curriculum.artifact_pipeline.steps"},"symbol":"curriculum.artifact_pipeline.steps","type":{"item":{"args":[],"kind":"named","name":"curriculum.artifact_pipeline.BuildStep"},"kind":"list"}}],"kind":"intrinsic","name":"permutation_by","reference":null,"selector":{"field":"curriculum.artifact_pipeline.BuildStep.name","owner":"curriculum.artifact_pipeline.BuildStep"},"type":{"kind":"primitive","name":"bool"}},"guard":{"pattern":{"arguments":[{"kind":"binding","name":"ordered_steps","symbol":"curriculum.artifact_pipeline.ordered_steps","type":{"item":{"kind":"primitive","name":"str"},"kind":"list"}}],"kind":"result_ok","symbol":"Result.Ok","type":{"error":{"args":[],"kind":"named","name":"curriculum.artifact_pipeline.ArtifactPipelineError"},"kind":"result","ok":{"item":{"kind":"primitive","name":"str"},"kind":"list"}}},"scrutinee":{"kind":"result_ref","reference":null,"type":{"error":{"args":[],"kind":"named","name":"curriculum.artifact_pipeline.ArtifactPipelineError"},"kind":"result","ok":{"item":{"kind":"primitive","name":"str"},"kind":"list"}}}},"kind":"ensures"},{"clause_id":2,"expression":{"arguments":[{"kind":"binding_ref","reference":{"kind":"binding","symbol":"curriculum.artifact_pipeline.ordered_steps"},"symbol":"curriculum.artifact_pipeline.ordered_steps","type":{"item":{"kind":"primitive","name":"str"},"kind":"list"}},{"kind":"parameter_ref","reference":{"kind":"parameter","symbol":"curriculum.artifact_pipeline.steps"},"symbol":"curriculum.artifact_pipeline.steps","type":{"item":{"args":[],"kind":"named","name":"curriculum.artifact_pipeline.BuildStep"},"kind":"list"}}],"dependencies":{"field":"curriculum.artifact_pipeline.BuildStep.needs","owner":"curriculum.artifact_pipeline.BuildStep"},"kind":"intrinsic","name":"dependency_ordered_by","reference":null,"selector":{"field":"curriculum.artifact_pipeline.BuildStep.name","owner":"curriculum.artifact_pipeline.BuildStep"},"type":{"kind":"primitive","name":"bool"}},"guard":{"pattern":{"arguments":[{"kind":"binding","name":"ordered_steps","symbol":"curriculum.artifact_pipeline.ordered_steps","type":{"item":{"kind":"primitive","name":"str"},"kind":"list"}}],"kind":"result_ok","symbol":"Result.Ok","type":{"error":{"args":[],"kind":"named","name":"curriculum.artifact_pipeline.ArtifactPipelineError"},"kind":"result","ok":{"item":{"kind":"primitive","name":"str"},"kind":"list"}}},"scrutinee":{"kind":"result_ref","reference":null,"type":{"error":{"args":[],"kind":"named","name":"curriculum.artifact_pipeline.ArtifactPipelineError"},"kind":"result","ok":{"item":{"kind":"primitive","name":"str"},"kind":"list"}}}},"kind":"ensures"},{"clause_id":4,"guard":null,"kind":"error","priority":null,"variant":"curriculum.artifact_pipeline.ArtifactPipelineError.BlankStepName","when":{"arguments":[{"kind":"parameter_ref","reference":{"kind":"parameter","symbol":"curriculum.artifact_pipeline.steps"},"symbol":"curriculum.artifact_pipeline.steps","type":{"item":{"args":[],"kind":"named","name":"curriculum.artifact_pipeline.BuildStep"},"kind":"list"}}],"kind":"intrinsic","name":"any_blank_by","reference":null,"selector":{"field":"curriculum.artifact_pipeline.BuildStep.name","owner":"curriculum.artifact_pipeline.BuildStep"},"type":{"kind":"primitive","name":"bool"}}},{"clause_id":5,"guard":null,"kind":"error","priority":null,"variant":"curriculum.artifact_pipeline.ArtifactPipelineError.DuplicateStep","when":{"kind":"unary","op":"not","operand":{"arguments":[{"kind":"parameter_ref","reference":{"kind":"parameter","symbol":"curriculum.artifact_pipeline.steps"},"symbol":"curriculum.artifact_pipeline.steps","type":{"item":{"args":[],"kind":"named","name":"curriculum.artifact_pipeline.BuildStep"},"kind":"list"}}],"kind":"intrinsic","name":"unique_by","reference":null,"selector":{"field":"curriculum.artifact_pipeline.BuildStep.name","owner":"curriculum.artifact_pipeline.BuildStep"},"type":{"kind":"primitive","name":"bool"}},"reference":null,"type":{"kind":"primitive","name":"bool"}}},{"clause_id":6,"guard":null,"kind":"error","priority":null,"variant":"curriculum.artifact_pipeline.ArtifactPipelineError.UnknownDependency","when":{"arguments":[{"kind":"parameter_ref","reference":{"kind":"parameter","symbol":"curriculum.artifact_pipeline.steps"},"symbol":"curriculum.artifact_pipeline.steps","type":{"item":{"args":[],"kind":"named","name":"curriculum.artifact_pipeline.BuildStep"},"kind":"list"}}],"dependencies":{"field":"curriculum.artifact_pipeline.BuildStep.needs","owner":"curriculum.artifact_pipeline.BuildStep"},"kind":"intrinsic","name":"unknown_dependency_by","reference":null,"selector":{"field":"curriculum.artifact_pipeline.BuildStep.name","owner":"curriculum.artifact_pipeline.BuildStep"},"type":{"kind":"primitive","name":"bool"}}},{"clause_id":7,"guard":null,"kind":"error","priority":null,"variant":"curriculum.artifact_pipeline.ArtifactPipelineError.SelfDependency","when":{"arguments":[{"kind":"parameter_ref","reference":{"kind":"parameter","symbol":"curriculum.artifact_pipeline.steps"},"symbol":"curriculum.artifact_pipeline.steps","type":{"item":{"args":[],"kind":"named","name":"curriculum.artifact_pipeline.BuildStep"},